{"artifact_refs":["docs/usage.md","README.md"],"attribution":{"agent":"writer","session_id":"526e52a3-e9e3-4c33-beef-674dde3acb04","transcript_ref":"/home/bits/.claude/projects/-tmp-anoikis-dogfood-runlog-stats--anoikis-runlog-stats-worktrees-usage-docs/526e52a3-e9e3-4c33-beef-674dde3acb04.jsonl"},"counts":{"passed":1},"excerpt":"docs/usage.md worked example verified byte-for-byte against a live run of the built binary; README wording reconciled; go vet/go test still pass; no Go source or testdata touched.","node_id":"usage-docs","run_id":"usage-docs-l2-a0","schema_version":"1.0.0","status":"pass"}
