{"artifact_refs":["docs/usage.md"],"attribution":{"agent":"writer","session_id":"8785758e-21f3-4600-a311-21c3286ab5e5","transcript_ref":"/home/bits/.claude/projects/-tmp-anoikis-dogfood-runlog-stats--anoikis-runlog-stats-worktrees-fix-f838e262-0/8785758e-21f3-4600-a311-21c3286ab5e5.jsonl"},"counts":{"passed":1},"excerpt":"Both review findings resolved for real: added a working build instruction (go build -o runlog-stats . verified; go build ./... variant's failure documented), corrected the false non-blank-line claim about lines_read/lines_skipped, re-verified the worked example against a fresh build.","node_id":"fix-f838e262-0","run_id":"fix-f838e262-0-l3-a0","schema_version":"1.0.0","status":"pass"}
