{"artifact_refs":["main.go","main_test.go","internal/runlogstats/runlogstats.go","internal/runlogstats/runlogstats_test.go","testdata/fixture.jsonl"],"attribution":{"agent":"tester","session_id":"78c83871-e008-43e6-9f33-8e647eb0cef3","transcript_ref":"/home/bits/.claude/projects/-tmp-anoikis-dogfood-runlog-stats--anoikis-runlog-stats-worktrees-cli-core/78c83871-e008-43e6-9f33-8e647eb0cef3.jsonl"},"counts":{"passed":22},"excerpt":"go build/vet/test clean; directory-as-input now exits 1 with a stderr message (regression fixed); fixture total_cost_usd=0.4600, unpriced_events=5, accounting reconciles 9=7+2; byte-identical across two runs.","node_id":"cli-core","run_id":"cli-core-l1-a1","schema_version":"1.0.0","status":"pass"}
