{"attribution":{"agent":"tester","session_id":"d32f4da9-2abf-4ad9-9a87-06badd5cf1fb","transcript_ref":"/home/bits/.claude/projects/-tmp-anoikis-dogfood-runlog-stats--anoikis-runlog-stats-worktrees-fix-054e9eeb-0/d32f4da9-2abf-4ad9-9a87-06badd5cf1fb.jsonl"},"counts":{"passed":21},"excerpt":"Zero findings scoped to cli-core (verified independently against the register); no change needed. go build/vet/test all pass, 21/21 tests, both read-failure modes and cost accounting re-verified.","node_id":"fix-054e9eeb-0","run_id":"fix-054e9eeb-0-l3-a0","schema_version":"1.0.0","status":"pass"}
